{
  "schema_version": "1.4",
  "status": "ok",
  "source": "home_assistant_rest_history",
  "date": "2026-10-25",
  "timezone": "Europe/Berlin",
  "start_local": "2026-10-25T00:00:00+02:00",
  "end_local": "2026-10-26T00:00:00+01:00",
  "start_utc": "2026-10-24T22:00:00+00:00",
  "end_utc": "2026-10-25T23:00:00+00:00",
  "export_started_at": "<volatile>",
  "export_finished_at": "<volatile>",
  "duration_seconds": "<volatile>",
  "entity_count_current": 7,
  "entity_count_requested": 5,
  "entity_count_with_history": 3,
  "entity_count_zero_history": 2,
  "state_object_count": 4,
  "batch_size_entities": 2,
  "request_count": 3,
  "failed_request_count": 0,
  "retried_request_count": 0,
  "history_request_options": {
    "minimal_response": false,
    "no_attributes": false,
    "significant_changes_only": false,
    "skip_initial_state": true
  },
  "capture_profile": {
    "response": "full",
    "attributes": "full",
    "state_changes": "all",
    "initial_state": "omitted"
  },
  "retention": {
    "status": "known_safe",
    "purge_keep_days": 14
  },
  "output_files": {
    "jsonl": "2026-10-25.jsonl",
    "csv": "2026-10-25.csv",
    "parquet": "2026-10-25.parquet"
  },
  "artifacts": {
    "jsonl": {
      "filename": "2026-10-25.jsonl",
      "size_bytes": "<volatile>",
      "sha256": "<volatile>",
      "row_count": 4,
      "logical_sha256": "8de4740d76e949ce3e9feef21f99e494eae4d1599c2424a61a5695c976087fd3"
    },
    "csv": {
      "filename": "2026-10-25.csv",
      "size_bytes": 904,
      "sha256": "c168e8479cb582bde84ce12e3dac2a95923fd87c618b5e72accd85ca6462d66f",
      "row_count": 4,
      "logical_sha256": "8de4740d76e949ce3e9feef21f99e494eae4d1599c2424a61a5695c976087fd3"
    },
    "parquet": {
      "filename": "2026-10-25.parquet",
      "size_bytes": "<volatile>",
      "sha256": "<volatile>",
      "row_count": 4,
      "logical_sha256": "8de4740d76e949ce3e9feef21f99e494eae4d1599c2424a61a5695c976087fd3"
    }
  },
  "zero_history_entities": [
    "sensor.never_recorded",
    "sensor.status_note"
  ],
  "failed_batches": [],
  "skipped_reason": null,
  "error": null,
  "error_code": null,
  "script_version": "<volatile>"
}
