{
  "schema_version": "1.4",
  "status": "partial",
  "source": "home_assistant_rest_history",
  "date": "2026-10-26",
  "timezone": "Europe/Berlin",
  "start_local": "2026-10-26T00:00:00+01:00",
  "end_local": "2026-10-26T14:30:15+01:00",
  "start_utc": "2026-10-25T23:00:00+00:00",
  "end_utc": "2026-10-26T13:30:15+00:00",
  "export_started_at": "<volatile>",
  "export_finished_at": "<volatile>",
  "duration_seconds": "<volatile>",
  "entity_count_current": 3,
  "entity_count_requested": 3,
  "entity_count_with_history": 1,
  "entity_count_zero_history": 2,
  "state_object_count": 1,
  "batch_size_entities": 2,
  "request_count": 2,
  "failed_request_count": 0,
  "retried_request_count": 0,
  "history_request_options": {
    "minimal_response": false,
    "no_attributes": false,
    "significant_changes_only": false,
    "skip_initial_state": true
  },
  "capture_profile": {
    "response": "full",
    "attributes": "full",
    "state_changes": "all",
    "initial_state": "omitted"
  },
  "retention": {
    "status": "partial_current",
    "purge_keep_days": 14
  },
  "output_files": {
    "jsonl": "2026-10-26.jsonl",
    "csv": "2026-10-26.csv",
    "parquet": null
  },
  "artifacts": {
    "jsonl": {
      "filename": "2026-10-26.jsonl",
      "size_bytes": 311,
      "sha256": "4bebe4033ac3a823da74eee3e7fed62a4a3706395a980bd5ba3e78f34adb145b",
      "row_count": 1,
      "logical_sha256": "c5d59c285638de02c87359df28540de338ee5cf392c7948a76525615c8a97f12"
    },
    "csv": {
      "filename": "2026-10-26.csv",
      "size_bytes": 309,
      "sha256": "93145d5e17312bd0ed555599ea7df9cdf5be912767b74f256f58142c87b611af",
      "row_count": 1,
      "logical_sha256": "c5d59c285638de02c87359df28540de338ee5cf392c7948a76525615c8a97f12"
    },
    "parquet": null
  },
  "zero_history_entities": [
    "binary_sensor.front_door",
    "sensor.status_note"
  ],
  "failed_batches": [],
  "skipped_reason": null,
  "error": null,
  "error_code": null,
  "script_version": "<volatile>"
}
