{
  "schema_version": "1.4",
  "status": "ok",
  "source": "home_assistant_rest_history",
  "date": "2026-10-25",
  "timezone": "Europe/Berlin",
  "start_local": "2026-10-25T00:00:00+02:00",
  "end_local": "2026-10-26T00:00:00+01:00",
  "start_utc": "2026-10-24T22:00:00+00:00",
  "end_utc": "2026-10-25T23:00:00+00:00",
  "export_started_at": "<volatile>",
  "export_finished_at": "<volatile>",
  "duration_seconds": "<volatile>",
  "entity_count_current": 3,
  "entity_count_requested": 3,
  "entity_count_with_history": 1,
  "entity_count_zero_history": 2,
  "state_object_count": 1,
  "batch_size_entities": 2,
  "request_count": 2,
  "failed_request_count": 0,
  "retried_request_count": 0,
  "history_request_options": {
    "minimal_response": false,
    "no_attributes": false,
    "significant_changes_only": false,
    "skip_initial_state": true
  },
  "capture_profile": {
    "response": "full",
    "attributes": "full",
    "state_changes": "all",
    "initial_state": "omitted"
  },
  "retention": {
    "status": "known_safe",
    "purge_keep_days": 14
  },
  "output_files": {
    "jsonl": "2026-10-25.jsonl",
    "csv": null,
    "parquet": null
  },
  "artifacts": {
    "jsonl": {
      "filename": "2026-10-25.jsonl",
      "size_bytes": 245,
      "sha256": "4769d40f43e05a9d5b6ffcff8fb8e41dd88bd4846c5f46340ee90e9079ec3bf8",
      "row_count": 1,
      "logical_sha256": "3edddc241103ce2a197b1e1fe845233ee46170fc018986165656777915ba4de1"
    },
    "csv": null,
    "parquet": null
  },
  "zero_history_entities": [
    "sensor.kitchen_temperature",
    "sensor.status_note"
  ],
  "failed_batches": [],
  "skipped_reason": null,
  "error": null,
  "error_code": null,
  "script_version": "<volatile>"
}
